{
  "$schema": "../../../../../../schemas/blueprint.schema.json",
  "id": "procurement-spend-analyst",
  "version": "1.0.0",
  "name": "Procurement Spend Analyst",
  "description": "Helps procurement officers analyze spend data, summarize supplier performance, identify savings opportunities, and prepare procurement reports.",

  "metadata": {
    "sector": "operations",
    "role": "procurement-officer",
    "author": "Agent Universe",
    "created": "2025-01-15",
    "updated": "2025-01-15",
    "tags": [
      "procurement",
      "spend-analysis",
      "reporting",
      "supplier-performance",
      "cost-savings",
      "analytics",
      "dashboards"
    ]
  },

  "friction_addressed": [
    {
      "type": "reporting_overhead",
      "description": "Aggregating spend data from multiple sources and preparing management reports and savings analyses"
    },
    {
      "type": "data_analysis",
      "description": "Processing and interpreting procurement data to identify trends, anomalies, and opportunities"
    },
    {
      "type": "vendor_supplier_evaluation",
      "description": "Comparing supplier performance across metrics and identifying underperforming vendors"
    }
  ],

  "value_proposition": {
    "time_saved_per_week_hours": 3,
    "primary_benefit": "Faster insights from procurement data without manual spreadsheet work",
    "secondary_benefits": [
      "Consistent report formatting and metrics",
      "Easier identification of cost-saving opportunities",
      "Quick supplier performance comparisons",
      "Better preparation for vendor negotiations"
    ]
  },

  "capabilities": {
    "required": [
      {
        "name": "OneDriveAndSharePoint",
        "reason": "Agent needs access to spend reports, supplier scorecards, contract summaries, and procurement analytics files",
        "setup_instructions": "Configure with SharePoint sites/folders containing: (1) spend reports and extracts, (2) supplier performance data, (3) contract summaries, (4) procurement dashboards/analytics"
      },
      {
        "name": "CodeInterpreter",
        "reason": "Agent needs to analyze data, perform calculations, and generate visualizations from spend data",
        "setup_instructions": "Enable Code Interpreter capability — no additional configuration required"
      }
    ],
    "optional": [
      {
        "name": "GraphConnectors",
        "reason": "Can connect to ERP or procurement systems via Graph connectors for real-time data",
        "setup_instructions": "Configure if organization has Graph connectors for procurement/ERP systems (e.g., SAP, Oracle, Coupa)"
      }
    ]
  },

  "actions": {
    "has_actions": false,
    "description": "This agent analyzes data and produces insights but does not modify source data or systems. Users export results for use in other tools."
  },

  "conversation_starters": [
    {
      "title": "Spend summary",
      "text": "Summarize our procurement spend for [time period]"
    },
    {
      "title": "Top suppliers",
      "text": "Who are our top 10 suppliers by spend?"
    },
    {
      "title": "Category analysis",
      "text": "Break down spend by category for [time period]"
    },
    {
      "title": "Supplier comparison",
      "text": "Compare performance of [supplier A] vs [supplier B]"
    },
    {
      "title": "Savings opportunities",
      "text": "Where are the biggest opportunities to reduce procurement costs?"
    },
    {
      "title": "Trend analysis",
      "text": "How has our spend with [supplier/category] changed over time?"
    }
  ],

  "setup": {
    "complexity": "medium",
    "estimated_time_minutes": 30,
    "prerequisites": [
      "SharePoint site or folder containing spend reports (CSV, Excel)",
      "Supplier performance data accessible via SharePoint",
      "Contract summary data for spend context",
      "Microsoft 365 Copilot license for users who will use the agent",
      "Spend data should be in analyzable format (structured tables, not just PDFs)"
    ]
  },

  "governance": {
    "data_accessed": [
      "Procurement spend reports and extracts",
      "Supplier performance scorecards",
      "Contract value summaries",
      "Category spend breakdowns",
      "Historical procurement data"
    ],
    "data_not_accessed": [
      "Live ERP/financial systems (unless Graph connector configured)",
      "Individual invoice details",
      "Employee compensation data",
      "Customer data"
    ],
    "recommended_audience": [
      "Procurement Officers",
      "Procurement Managers",
      "Category Managers",
      "Sourcing Analysts",
      "Finance Business Partners"
    ],
    "admin_considerations": [
      "Ensure spend data is appropriately anonymized or access-controlled",
      "Consider data freshness — agent analyzes uploaded/stored data, not real-time",
      "Large datasets may require chunking or summarization before upload",
      "Verify calculations against source systems for critical decisions"
    ]
  }
}
